{
  "$schema": "https://json-schema.org/draft/2020-12/schema",
  "$id": "https://github.com/mveril/RustiQ/blob/main/schemas/calculation-snapshot-v1.schema.json",
  "title": "RustiQ resolved scientific calculation V1",
  "type": "object",
  "additionalProperties": false,
  "required": [
    "format",
    "version",
    "units",
    "atoms",
    "charge",
    "multiplicity",
    "basis",
    "hf",
    "ao_eri_computation_version"
  ],
  "properties": {
    "format": {
      "const": "rustiq-calculation"
    },
    "version": {
      "const": 1
    },
    "units": {
      "const": "bohr"
    },
    "atoms": {
      "type": "array",
      "minItems": 1,
      "items": {
        "$ref": "#/$defs/atom"
      }
    },
    "charge": {
      "type": "integer",
      "minimum": -2147483648,
      "maximum": 2147483647
    },
    "multiplicity": {
      "type": "integer",
      "minimum": 1,
      "maximum": 255
    },
    "basis": {
      "type": "array",
      "minItems": 1,
      "items": {
        "$ref": "#/$defs/ao"
      }
    },
    "hf": {
      "$ref": "#/$defs/hf"
    },
    "mp2": {
      "anyOf": [
        {
          "$ref": "#/$defs/mp2"
        },
        {
          "type": "null"
        }
      ]
    },
    "ao_eri_computation_version": {
      "type": "integer",
      "minimum": 1,
      "maximum": 4294967295
    }
  },
  "$defs": {
    "atom": {
      "type": "object",
      "additionalProperties": false,
      "required": [
        "atomic_number",
        "position"
      ],
      "properties": {
        "atomic_number": {
          "type": "integer",
          "minimum": 1,
          "maximum": 118
        },
        "position": {
          "type": "array",
          "minItems": 3,
          "maxItems": 3,
          "items": {
            "type": "number"
          }
        }
      }
    },
    "primitive": {
      "type": "object",
      "additionalProperties": false,
      "required": [
        "exponent",
        "coefficient"
      ],
      "properties": {
        "exponent": {
          "type": "number",
          "exclusiveMinimum": 0
        },
        "coefficient": {
          "type": "number"
        }
      }
    },
    "component": {
      "type": "object",
      "additionalProperties": false,
      "required": [
        "angular_momentum",
        "primitives"
      ],
      "properties": {
        "angular_momentum": {
          "type": "array",
          "minItems": 3,
          "maxItems": 3,
          "items": {
            "type": "integer",
            "minimum": 0,
            "maximum": 255
          }
        },
        "primitives": {
          "type": "array",
          "minItems": 1,
          "items": {
            "$ref": "#/$defs/primitive"
          }
        }
      }
    },
    "ao": {
      "type": "object",
      "additionalProperties": false,
      "required": [
        "center",
        "components"
      ],
      "properties": {
        "center": {
          "type": "array",
          "minItems": 3,
          "maxItems": 3,
          "items": {
            "type": "number"
          }
        },
        "components": {
          "type": "array",
          "minItems": 1,
          "items": {
            "$ref": "#/$defs/component"
          }
        }
      }
    },
    "distribution": {
      "oneOf": [
        {
          "type": "object",
          "additionalProperties": false,
          "required": [
            "kind",
            "min",
            "max"
          ],
          "properties": {
            "kind": {
              "const": "uniform"
            },
            "min": {
              "type": "number"
            },
            "max": {
              "type": "number"
            }
          }
        },
        {
          "type": "object",
          "additionalProperties": false,
          "required": [
            "kind",
            "mean",
            "std_dev"
          ],
          "properties": {
            "kind": {
              "const": "normal"
            },
            "mean": {
              "type": "number"
            },
            "std_dev": {
              "type": "number",
              "exclusiveMinimum": 0
            }
          }
        }
      ]
    },
    "random": {
      "type": "object",
      "additionalProperties": false,
      "required": [
        "distribution"
      ],
      "properties": {
        "seed": {
          "anyOf": [
            {
              "type": "integer",
              "minimum": 0,
              "maximum": 18446744073709551615
            },
            {
              "type": "null"
            }
          ]
        },
        "distribution": {
          "$ref": "#/$defs/distribution"
        }
      }
    },
    "guess": {
      "oneOf": [
        {
          "type": "object",
          "additionalProperties": false,
          "required": [
            "kind"
          ],
          "properties": {
            "kind": {
              "const": "core_hamiltonian"
            },
            "perturbation": {
              "anyOf": [
                {
                  "$ref": "#/$defs/random"
                },
                {
                  "type": "null"
                }
              ]
            }
          }
        },
        {
          "type": "object",
          "additionalProperties": false,
          "required": [
            "kind"
          ],
          "properties": {
            "kind": {
              "const": "one_electron"
            },
            "perturbation": {
              "anyOf": [
                {
                  "$ref": "#/$defs/random"
                },
                {
                  "type": "null"
                }
              ]
            }
          }
        },
        {
          "type": "object",
          "additionalProperties": false,
          "required": [
            "kind",
            "random"
          ],
          "properties": {
            "kind": {
              "const": "random"
            },
            "random": {
              "$ref": "#/$defs/random"
            }
          }
        },
        {
          "type": "object",
          "additionalProperties": false,
          "required": [
            "kind"
          ],
          "properties": {
            "kind": {
              "const": "zero"
            }
          }
        }
      ]
    },
    "hf": {
      "type": "object",
      "additionalProperties": false,
      "required": [
        "method",
        "max_iterations",
        "convergence_threshold",
        "linear_dependency_threshold",
        "guess"
      ],
      "properties": {
        "method": {
          "enum": [
            "rhf",
            "uhf"
          ]
        },
        "max_iterations": {
          "type": "integer",
          "minimum": 1
        },
        "convergence_threshold": {
          "type": "number",
          "exclusiveMinimum": 0
        },
        "linear_dependency_threshold": {
          "type": "number",
          "minimum": 0
        },
        "eri_schwarz_threshold": {
          "anyOf": [
            {
              "type": "number",
              "exclusiveMinimum": 0
            },
            {
              "type": "null"
            }
          ]
        },
        "diis_size": {
          "anyOf": [
            {
              "type": "integer",
              "minimum": 2
            },
            {
              "type": "null"
            }
          ]
        },
        "guess": {
          "$ref": "#/$defs/guess"
        }
      }
    },
    "mp2": {
      "type": "object",
      "additionalProperties": false,
      "required": [
        "frozen_orbitals"
      ],
      "properties": {
        "frozen_orbitals": {
          "type": "integer",
          "minimum": 0
        }
      }
    }
  }
}
